"ENSEMBL"	"DESCRIPTION"
"481"	"YML117W"	"Putative RNA-binding protein; associates with mRNAs encoding cell wall proteins in high-throughput studies; deletion mutants display increased sensitivity to some cell wall disrupting agents; expression negatively regulated by cAMP"
"482"	"YMR012W"	"Subunit of the eukaryotic translation initiation factor 3 (eIF3); component of unknown function; deletion causes defects in mitochondrial organization but not in growth or translation initiation; can rescue cytokinesis and mitochondrial organization defects of the Dictyostelium cluA- mutant"
"483"	"YMR014W"	"Protein required for rRNA maturation and ribosomal subunit biogenesis; required for 18S rRNA maturation; also required for small ribosomal subunit biogenesis; cosediments with pre-ribosomal particles; mutation decreases efficiency of +1 Ty1 frameshifting and transposition, and affects budding pattern"
"484"	"YMR031C"	"Component of the eisosome required for proper eisosome assembly; similar to Uso1p; authentic, non-tagged protein is detected in a phosphorylated state in highly purified mitochondria in high-throughput studies; protein increases in abundance and relocalizes from plasma membrane to cytoplasm upon DNA replication stress; EIS1 has a paralog, YKL050C, that arose from the whole genome duplication"
"485"	"YMR039C"	"Transcriptional coactivator; facilitates elongation through factors that modify RNAP II; role in peroxide resistance involving Rad2p; role in nonhomologous end-joining (NHEJ); role in the hyperosmotic stress response through polymerase recruitment at RNAP II and RNAP III genes; protein abundance increases in response to DNA replication stress"
"486"	"YMR070W"	"Transcriptional repressor and activator with two C2-H2 zinc fingers; involved in repression of a subset of hypoxic genes by Rox1p, repression of several DAN/TIR genes during aerobic growth and ergosterol biosynthetic genes in response to hyperosmotic stress; contributes to recruitment of Tup1p-Cyc8p general repressor to promoters; involved in positive transcriptional regulation of CWP2 and other genes; relocalizes to the cytosol in response to hypoxia; can form [MOT3+] prion"
"487"	"YMR079W"	"Phosphatidylinositol/phosphatidylcholine transfer protein; involved in regulating PtdIns, PtdCho, and ceramide metabolism, products of which regulate intracellular transport and UPR; has a role in localization of lipid raft proteins; functionally homologous to mammalian PITPs; SEC14 has a paralog, YKL091C, that arose from the whole genome duplication"
"488"	"YMR080C"	"ATP-dependent RNA helicase of the SFI superfamily; involved in nonsense mediated mRNA decay; required for efficient translation termination at nonsense codons and targeting of NMD substrates to P-bodies; binds to the small ribosomal subunit via an interaction with Rps26; forms cytoplasmic foci upon DNA replication stress"
"489"	"YMR092C"	"Actin cortical patch component; interacts with the actin depolymerizing factor cofilin; inhibits elongation of aged ADP-actin filaments decorated with cofilin to maintain a high level of assembly-competent actin species; required to restrict cofilin localization to cortical patches; contains WD repeats; protein increases in abundance and relocalizes from cytoplasm to plasma membrane upon DNA replication stress"
"490"	"YMR093W"	"Nucleolar protein; component of the small subunit (SSU) processome containing the U3 snoRNA that is involved in processing of pre-18S rRNA"
"491"	"YMR099C"	"Glucose-6-phosphate 1-epimerase (hexose-6-phosphate mutarotase); likely involved in carbohydrate metabolism; GFP-fusion protein localizes to both the nucleus and cytoplasm and is induced in response to the DNA-damaging agent MMS"
"492"	"YMR116C"	"G-protein beta subunit and guanine dissociation inhibitor for Gpa2p; ortholog of RACK1 that inhibits translation; core component of the small (40S) ribosomal subunit; regulates P-body formation induced by replication stress; represses Gcn4p in the absence of amino acid starvation"
"493"	"YMR125W"	"Large subunit of the nuclear mRNA cap-binding protein complex; interacts with Npl3p to carry nuclear poly(A)+ mRNA to cytoplasm; also involved in nuclear mRNA degradation and telomere maintenance; orthologous to mammalian CBP80"
"494"	"YMR128W"	"Essential DEAH-box ATP-dependent RNA helicase specific to U3 snoRNP; predominantly nucleolar in distribution; required for 18S rRNA synthesis"
"495"	"YMR131C"	"Nuclear protein involved in early steps of ribosome biogenesis; physically interacts with the ribosomal protein Rpl3p; essential gene"
"496"	"YMR140W"	"Protein of unknown function; interacts with both the Reg1p/Glc7p phosphatase and the Snf1p kinase; forms cytoplasmic foci upon DNA replication stress"
"497"	"YMR142C"	"Ribosomal 60S subunit protein L13B; not essential for viability; homologous to mammalian ribosomal protein L13, no bacterial homolog; RPL13B has a paralog, RPL13A, that arose from the whole genome duplication"
"498"	"YMR143W"	"Protein component of the small (40S) ribosomal subunit; homologous to mammalian ribosomal protein S16 and bacterial S9; RPS16A has a paralog, RPS16B, that arose from the whole genome duplication"
"499"	"YMR143W"	"Protein component of the small (40S) ribosomal subunit; homologous to mammalian ribosomal protein S16 and bacterial S9; RPS16B has a paralog, RPS16A, that arose from the whole genome duplication"
"500"	"YMR146C"	"eIF3i subunit of the eukaryotic translation initiation factor 3 (eIF3); subunit of the core complex of eIF3; essential for translation; stimulates rate of ribosomal scanning during translation reinitiation"
"501"	"YMR147W"	"Putative protein of unknown function"
"502"	"YMR173W"	"DNA damage-responsive protein; expression is increased in response to heat-shock stress or treatments that produce DNA lesions; contains multiple repeats of the amino acid sequence NNNDSYGS; protein abundance increases in response to DNA replication stress"
"503"	"YMR178W"	"Protein of unknown function; green fluorescent protein (GFP)-fusion protein localizes to both the cytoplasm and nucleus; YMR178W is not an essential gene; protein abundance increases in response to DNA replication stress"
"504"	"YMR180C"	"RNA 5'-triphosphatase, localizes to both the nucleus and cytoplasm; CTL1 has a paralog, CET1, that arose from the whole genome duplication"
"505"	"YMR186W"	"Cytoplasmic chaperone of the Hsp90 family; plays a role in determining prion variants; redundant in function and nearly identical with Hsp82p, and together they are essential; expressed constitutively at 10-fold higher basal levels than HSP82 and induced 2-3 fold by heat shock; contains two acid-rich unstructured regions that promote the solubility of chaperone-substrate complexes; HSC82 has a paralog, HSP82, that arose from the whole genome duplication"
"506"	"YMR205C"	"Beta subunit of heterooctameric phosphofructokinase; involved in glycolysis; indispensable for anaerobic growth; activated by fructose-2,6-bisphosphate and AMP; mutation inhibits glucose induction of cell cycle-related genes"
"507"	"YMR212C"	"Protein required for Stt4-containing PI kinase complex localization; required for Stt4-containing phosphoinositide (PI) kinase patch assembly at the plasma membrane; exhibits synthetic lethal genetic interactions with PHO85; has sequence similarity to the Drosophila rolling blackout (RBO) gene"
"508"	"YMR217W"	"GMP synthase; highly conserved enzyme that catalyzes the second step in the biosynthesis of GMP from inosine 5'-phosphate (IMP); transcription is not subject to regulation by guanine but is negatively regulated by nutrient starvation; reduction-of-function mutation gua1-G388D causes changes in cellular guanine nucleotide pools, defects in general protein synthesis, and impaired translation of GCN4 mRNA"
"509"	"YMR219W"	"Protein localized to the nuclear periphery; involved in telomeric silencing; interacts with PAD4-domain of Sir4p"
"510"	"YMR229C"	"RNA binding protein involved in synthesis of both 18S and 5.8S rRNAs; component of both the ribosomal small subunit (SSU) processosome and the 90S preribosome; has binding preference for single stranded tracts of U's; relocalizes from nucleolus to nucleus upon DNA replication stress"
"511"	"YMR230W"	"Protein component of the small (40S) ribosomal subunit; homologous to mammalian ribosomal protein S10, no bacterial homolog; RPS10B has a paralog, RPS10A, that arose from the whole genome duplication"
"512"	"YMR255W"	"Coiled-coiled protein of unknown function; identified as a high-copy suppressor of a dbp5 mutation; protein abundance increases in response to DNA replication stress"
"513"	"YMR260C"	"Translation initiation factor eIF1A; essential protein that forms a complex with Sui1p (eIF1) and the 40S ribosomal subunit and scans for the start codon; C-terminus associates with Fun12p (eIF5B); N terminus interacts with eIF2 and eIF3"
"514"	"YMR265C"	"Putative protein of unknown function"
"515"	"YMR268C"	"Splicing factor that reanneals snRNPs during spliceosome recycling; reanneals U4 and U6 snRNPs"
"516"	"YMR273C"	"Protein with a role in regulating Swe1p-dependent polarized growth; involved in maintaining Cdc55p in the cytoplasm where it promotes mitotic entry; involved in mitotic exit through Cdc14p regulation; interacts with silencing proteins at telomeres; has a role in Bcy1p localization; implicated in mRNA nuclear export; ZDS1 has a paralog, ZDS2, that arose from the whole genome duplication"
"517"	"YMR285C"	"Protein involved in 5.8S rRNA processing; Ccr4p-like RNase required for correct 3'-end formation of 5.8S rRNA at site E; similar to Ngl1p; NGL2 has a paralog, NGL3, that arose from the whole genome duplication"
"518"	"YMR288W"	"U2-snRNP associated splicing factor; forms extensive associations with the branch site-3' splice site-3' exon region upon prespliceosome formation; similarity to the mammalian U2 snRNP-associated splicing factor SAP155"
"519"	"YMR290C"	"ATP-dependent RNA helicase; involved in the biogenesis of 40S and 60S ribosome subunits; localizes to both the nuclear periphery and nucleolus; highly enriched in nuclear pore complex fractions; constituent of 66S pre-ribosomal particles"
"520"	"YMR309C"	"eIF3c subunit of the eukaryotic translation initiation factor 3 (eIF3); involved in the assembly of preinitiation complex and start codon selection"
"521"	"YNL004W"	"Poly(A+) RNA-binding protein; involved in the export of mRNAs from the nucleus to the cytoplasm; similar to Npl3p; HRB1 has a paralog, GBP2, that arose from the whole genome duplication"
"522"	"YNL015W"	"Cytosolic inhibitor of vacuolar proteinase B (PRB1); required for efficient vacuole inheritance; with thioredoxin forms protein complex LMA1, which assists in priming SNARE molecules and promotes vacuole fusion; protein abundance increases in response to DNA replication stress"
"523"	"YNL016W"	"Poly (A)+ RNA-binding protein; abundant mRNP-component protein that binds mRNA and is required for stability of many mRNAs; component of glucose deprivation induced stress granules, involved in P-body-dependent granule assembly; protein abundance increases in response to DNA replication stress"
"524"	"YNL035C"	"Nuclear protein of unknown function; relocalizes to the cytosol in response to hypoxia; contains WD-40 domains; not an essential gene; protein abundance increases in response to DNA replication stress"
"525"	"YNL061W"	"rRNA m5C methyltransferase; methylates cytosine at position 2870 of 25S rRNA while Rcm1p methylates cytosine at position 2278; contains seven beta-strand methyltransferase motif; essential for processing and maturation of 27S pre-rRNA and large ribosomal subunit biogenesis; localized to the nucleolus; constituent of 66S pre-ribosomal particles; homolog of p120/NSUN1, a human gene upregulated in cancer"
"526"	"YNL064C"	"Type I HSP40 co-chaperone; involved in regulation of HSP90 and HSP70 functions; critical for determining cell size at Start as a function of growth rate; involved in protein translocation across membranes; member of the DnaJ family"
"527"	"YNL069C"	"Ribosomal 60S subunit protein L16B; N-terminally acetylated, binds 5.8 S rRNA; transcriptionally regulated by Rap1p; homologous to mammalian ribosomal protein L13A and bacterial L13; RPL16B has a paralog, RPL16A, that arose from the whole genome duplication"
"528"	"YNL075W"	"Component of the SSU processome; SSU processome is required for pre-18S rRNA processing; interacts with Mpp10p; member of a superfamily of proteins that contain a sigma(70)-like motif and associate with RNAs"
"529"	"YNL079C"	"Major isoform of tropomyosin; binds to and stabilizes actin cables and filaments, which direct polarized cell growth and the distribution of several organelles; acetylated by the NatB complex and acetylated form binds actin most efficiently; TPM1 has a paralog, TPM2, that arose from the whole genome duplication"
"530"	"YNL088W"	"Topoisomerase II; relieves torsional strain in DNA by cleaving and re-sealing the phosphodiester backbone of both positively and negatively supercoiled DNA; cleaves complementary strands; localizes to axial cores in meiosis; required for replication slow zone (RSZ) breakage following Mec1p inactivation"
"531"	"YNL096C"	"Protein component of the small (40S) ribosomal subunit; interacts with Kti11p; deletion causes hypersensitivity to zymocin; homologous to mammalian ribosomal protein S7, no bacterial homolog; RPS7B has a paralog, RPS7A, that arose from the whole genome duplication; protein abundance increases in response to DNA replication stress"
"532"	"YNL112W"	"ATP-dependent RNA helicase of the DEAD-box protein family; has a strong preference for dsRNA; interacts with YRA1; required for the assembly of Yra1p, Nab2p and Mex67p onto mRNA and formation of nuclear mRNP; involved in mRNA decay and rRNA processing; may be involved in suppression of transcription from cryptic initiation sites"
"533"	"YNL118C"	"Catalytic subunit of the Dcp1p-Dcp2p decapping enzyme complex; removes the 5' cap structure from mRNAs prior to their degradation; also enters the nucleus and positively regulates transcription initiation; nudix hydrolase family member; forms cytoplasmic foci upon DNA replication stress"
"534"	"YNL124W"	"RNA-binding protein required for the assembly of box H/ACA snoRNPs; thus required for pre-rRNA processing; forms a complex with Shq1p and interacts with H/ACA snoRNP components Nhp2p and Cbf5p; similar to Gar1p"
"535"	"YNL134C"	"Protein of unknown function; similar to dehydrogenases from other model organisms; green fluorescent protein (GFP)-fusion protein localizes to both the cytoplasm and nucleus; protein abundance increases in response to DNA replication stress"
"536"	"YNL135C"	"Peptidyl-prolyl cis-trans isomerase (PPIase); binds to the drugs FK506 and rapamycin; also binds to the nonhistone chromatin binding protein Hmo1p and may regulate its assembly or function"
"537"	"YNL139C"	"Subunit of the THO complex; THO is required for efficient transcription elongation and involved in transcriptional elongation-associated recombination; required for LacZ RNA expression from certain plasmids"
"538"	"YNL147W"	"Lsm (Like Sm) protein; part of heteroheptameric complexes (Lsm2p-7p and either Lsm1p or 8p): cytoplasmic Lsm1p complex involved in mRNA decay; nuclear Lsm8p complex part of U6 snRNP and possibly involved in processing tRNA, snoRNA, and rRNA; protein abundance increases and forms cytoplasmic foci in response to DNA replication stress"
"539"	"YNL154C"	"Palmitoylated plasma membrane-bound casein kinase I isoform; shares redundant functions with Yck1p in morphogenesis, proper septin assembly, endocytic trafficking, and glucose sensing; stabilized by Sod1p binding in the presence of glucose and oxygen, causing glucose repression of respiratory metabolism; YCK2 has a paralog, YCK1, that arose from the whole genome duplication"
"540"	"YNL160W"	"Cell wall-related secretory glycoprotein; induced by nutrient deprivation-associated growth arrest and upon entry into stationary phase; may be involved in adaptation prior to stationary phase entry; YGP1 has a paralog, SPS100, that arose from the whole genome duplication"
"541"	"YNL166C"	"Protein involved in organization of septins at the mother-bud neck; may interact directly with the Cdc11p septin, localizes to bud neck in a septin-dependent manner"
"542"	"YNL175C"	"Nucleolar protein found in preribosomal complexes; contains an RNA recognition motif (RRM); relative distribution to the nucleolus increases upon DNA replication stress"
"543"	"YNL178W"	"Protein component of the small (40S) ribosomal subunit; has apurinic/apyrimidinic (AP) endonuclease activity; essential for viability; homologous to mammalian ribosomal protein S3 and bacterial S3"
"544"	"YNL189W"	"Karyopherin alpha homolog; forms a dimer with karyopherin beta Kap95p to mediate import of nuclear proteins, binds the nuclear localization signal of the substrate during import; may also play a role in regulation of protein degradation"
"545"	"YNL197C"	"RNA binding protein that sequesters CLN3 mRNA in cytoplasmic foci; acts as a cytoplasmic retention factor for Cdc28p and associated cyclins; regulates cell fate and dose-dependently regulates the critical cell size required for passage through Start; Tpk1p (PKA) mediated phosphorylation (S568) inhibits Whi3p function, decreasing its interaction with CLN3 mRNA; WHI3 has a paralog, WHI4, that arose from the whole genome duplication"
"546"	"YNL207W"	"Essential serine kinase involved in the processing of 20S pre-rRNA; involved in the processing of the 20S pre-rRNA into mature 18S rRNA; has similarity to Rio1p"
"547"	"YNL208W"	"Protein of unknown function; may interact with ribosomes, based on co-purification experiments; authentic, non-tagged protein is detected in purified mitochondria in high-throughput studies; potential orthologs found in other fungi"
"548"	"YNL209W"	"Cytoplasmic ATPase that is a ribosome-associated molecular chaperone; functions with J-protein partner Zuo1p; may be involved in the folding of newly-synthesized polypeptide chains; member of the HSP70 family; SSB2 has a paralog, SSB1, that arose from the whole genome duplication"
"549"	"YNL224C"	"Protein that stimulates the ATPase and helicase activities of Prp43p; acts with Prp43p to stimulate 18s rRNA maturation by Nob1p; overexpression antagonizes the suppression of splicing defects by spp382 mutants; component of pre-ribosomal particles; relocalizes from nucleus to nucleolus upon DNA replication stress"
"550"	"YNL239W"	"Cysteine aminopeptidase with homocysteine-thiolactonase activity; protects cells against homocysteine toxicity; has bleomycin hydrolase activity in vitro; transcription is regulated by galactose via Gal4p; orthologous to human BLMH"
"551"	"YNL240C"	"Subunit of the cytosolic iron-sulfur (FeS) protein assembly machinery; required for maturation of cytosolic and nuclear FeS proteins and for normal resistance to oxidative stress; homologous to human Narf"
"552"	"YNL244C"	"Translation initiation factor eIF1; component of a complex involved in recognition of the initiator codon; modulates translation accuracy at the initiation phase"
"553"	"YNL247W"	"Cysteinyl-tRNA synthetase; may interact with ribosomes, based on co-purification experiments"
"554"	"YNL251C"	"RNA-binding protein, subunit of Nrd1 complex (Nrd1p-Nab3p-Sen1p); complex interacts with the exosome to mediate 3&#8242; end formation of some mRNAs, snRNAs, snoRNAs, and CUTs; interacts with the C-terminal domain of the RNA polymerase II large subunit (Rpo21p), preferentially at phosphorylated Ser5, to direct transcription termination of non-polyadenylated transcripts; H3K4 trimethylation of transcribed regions by Set1p enhances recruitment of Nrd1p to those sites"
"555"	"YNL253W"	"Protein involved in mRNA export; component of the transcription export (TREX) complex"
"556"	"YNL255C"	"Translational activator for mRNAs with internal ribosome entry sites; associates with polysomes and binds to a specific subset of mRNAs; localizes to RNA processing bodies (P bodies) and to stress granules; may have a role in translation regulation under stress conditions; ortholog of human ZNF9/CNBP, a gene involved in myotonic dystrophy type 2"
"557"	"YNL262W"	"Catalytic subunit of DNA polymerase (II) epsilon; a chromosomal DNA replication polymerase that exhibits processivity and proofreading exonuclease activity; also involved in DNA synthesis during DNA repair; interacts extensively with Mrc1p"
"558"	"YNL287W"	"Gamma subunit of coatomer; coatomer is a heptameric protein complex that together with Arf1p forms the COPI coat; involved in ER to Golgi transport of selective cargo"
"559"	"YNL299W"	"Non-canonical poly(A) polymerase; involved in nuclear RNA degradation as a component of the TRAMP complex; catalyzes polyadenylation of hypomodified tRNAs, and snoRNA and rRNA precursors; overlapping but non-redundant functions with Pap2p; TRF5 has a paralog, PAP2, that arose from the whole genome duplication"
"560"	"YNL307C"	"Dual-specificity ser/thr and tyrosine protein kinase; roles in chromosome segregation, meiotic entry, genome stability, phosphorylation-dependent protein degradation (Rcn1p and Cdc6p), inhibition of protein kinase A, transcriptional regulation, inhibition of RNA pol III, calcium stress and inhibition of Clb2p-Cdc28p after nuclear division; MCK1 has a paralog, YGK3, that arose from the whole genome duplication"
"561"	"YNL308C"	"Essential nucleolar protein required for 40S ribosome biogenesis; associate with snR30; physically and functionally interacts with Krr1p"
"562"	"YNL317W"	"Integral subunit of the pre-mRNA CPF complex; the cleavage and polyadenylation factor (CPF) complex plays an essential role in mRNA 3'-end formation by bridging different processing factors and thereby promoting the assembly of the processing complex"
"563"	"YNR006W"	"Endosomal protein that forms a complex with Hse1p; required for recycling Golgi proteins, forming lumenal membranes and sorting ubiquitinated proteins destined for degradation; has Ubiquitin Interaction Motifs which bind ubiquitin (Ubi4p)"
"564"	"YNR016C"	"Acetyl-CoA carboxylase, biotin containing enzyme; catalyzes carboxylation of cytosolic acetyl-CoA to form malonyl-CoA and regulates histone acetylation by regulating the availablity of acetyl-CoA; required for de novo biosynthesis of long-chain fatty acids; ACC1 has a paralog, HFA1, that arose from the whole genome duplication"
"565"	"YNR038W"	"Essential protein involved in ribosome biogenesis; putative ATP-dependent RNA helicase of the DEAD-box protein family"
"566"	"YNR049C"	"Probable component of the secretory vesicle docking complex; acts at a late step in secretion; shows genetic and physical interactions with Sec1p; required for prospore membrane formation during sporulation; relocalizes from bud neck to nucleus upon DNA replication stress"
"567"	"YNR051C"	"Ubiquitin protease cofactor; forms deubiquitination complex with Ubp3p that coregulates anterograde and retrograde transport between the endoplasmic reticulum and Golgi compartments; null is sensitive to brefeldin A"
"568"	"YNR053C"	"Putative GTPase; associates with pre-60S ribosomal subunits in the nucleolus and is required for their nuclear export and maturation"
"569"	"YNR054C"	"Essential nucleolar protein involved in pre-18S rRNA processing; binds to RNA and stimulates ATPase activity of Dbp8; involved in assembly of the small subunit (SSU) processome"
"570"	"YOL012C"	"Histone variant H2AZ; exchanged for histone H2A in nucleosomes by the SWR1 complex; involved in transcriptional regulation through prevention of the spread of silent heterochromatin; Htz1p-containing nucleosomes facilitate RNA Pol II passage by affecting correct assembly and modification status of RNA Pol II elongation complexes and by favoring efficient nucleosome remodeling"
"571"	"YOL021C"	"Exosome core complex catalytic subunit; possesses both endonuclease and 3'-5' exonuclease activity; involved in 3'-5' RNA processing and degradation in both the nucleus and the cytoplasm; has similarity to E. coli RNase R and to human DIS3; mutations in Dis3p corresponding to human mutations implicated in multiple myeloma cause phenotypes suggesting impaired exosome function; protein abundance increases in response to DNA replication stress"
"572"	"YOL040C"	"Protein component of the small (40S) ribosomal subunit; homologous to mammalian ribosomal protein S15 and bacterial S19"
"573"	"YOL041C"	"Nucleolar protein involved in pre-25S rRNA processing; also involved in biogenesis of large 60S ribosomal subunit; contains an RNA recognition motif (RRM); binds to Ebp2; similar to Nop13p and Nsr1p"
"574"	"YOL059W"	"NAD-dependent glycerol 3-phosphate dehydrogenase; expression is controlled by an oxygen-independent signaling pathway required to regulate metabolism under anoxic conditions; located in cytosol and mitochondria; constitutively active but is inactivated via phosphorylation by energy-stress responsive kinase SNF1; GPD2 has a paralog, GPD1, that arose from the whole genome duplication"
"575"	"YOL076W"	"Non-catalytic subunit of the NatB N-terminal acetyltransferase; NatB catalyzes N-acetylation of proteins with specific N-terminal sequences; involved in mitochondrial inheritance and actin assembly"
"576"	"YOL077C"	"Nucleolar protein; constituent of 66S pre-ribosomal particles; depletion leads to defects in rRNA processing and a block in the assembly of large ribosomal subunits; possesses a sigma(70)-like RNA-binding motif"
"577"	"YOL086C"	"Alcohol dehydrogenase; fermentative isozyme active as homo- or heterotetramers; required for the reduction of acetaldehyde to ethanol, the last step in the glycolytic pathway; ADH1 has a paralog, ADH5, that arose from the whole genome duplication"
