"ENSEMBL"	"DESCRIPTION"
"390"	"YKL203C"	"PIK-related protein kinase and rapamycin target; subunit of TORC1, a complex that regulates growth in response to nutrients and TORC2, a complex that regulates cell-cycle dependent polarization of the actin cytoskeleton; involved in meiosis; TOR2 has a paralog, TOR1, that arose from the whole genome duplication"
"391"	"YKL204W"	"eIF4E-associated protein, competes with eIF4G for binding to eIF4E; accelerates mRNA degradation by promoting decapping, facilitated by interaction with eIF4E; essential for Puf5p mediated repression; associates with Puf5p and Dhh1p; inhibits cap-dependent translation; functions independently of eIF4E to maintain genetic stability; plays a role in cell growth, implicated in the TOR signaling cascade"
"392"	"YKL210W"	"Ubiquitin activating enzyme (E1); involved in ubiquitin-mediated protein degradation and essential for viability; protein abundance increases in response to DNA replication stress"
"393"	"YKL214C"	"Member of the REF (RNA and export factor binding proteins) family; when overexpressed, can substitute for the function of Yra1p in export of poly(A)+ mRNA from the nucleus"
"394"	"YKR001C"	"Dynamin-like GTPase required for vacuolar sorting; also involved in actin cytoskeleton organization, endocytosis, late Golgi-retention of some proteins, regulation of peroxisome biogenesis"
"395"	"YKR002W"	"Poly(A) polymerase; one of three factors required for mRNA 3'-end polyadenylation, forms multiprotein complex with polyadenylation factor I (PF I), also required for mRNA nuclear export; may also polyadenylate rRNAs; required for gene looping"
"396"	"YKR019C"	"EH domain-containing protein; involved in regulating phosphatidylinositol 4,5-bisphosphate levels and autophagy; Irs4p and Tax4p bind and activate the PtdIns phosphatase Inp51p; Irs4p and Tax4p are involved in localizing Atg17p to the PAS; IRS4 has a paralog, TAX4, that arose from the whole genome duplication"
"397"	"YKR023W"	"Putative protein of unknown function; the authentic, non-tagged protein is detected in highly purified mitochondria in high-throughput studies"
"398"	"YKR024C"	"Putative ATP-dependent RNA helicase of the DEAD-box family; involved in ribosomal biogenesis; required at post-transcriptional step for efficient retrotransposition; essential for growth under anaerobic conditions"
"399"	"YKR060W"	"Putative subunit of U3-containing 90S preribosome complex; complex is involved in production of 18S rRNA and assembly of small ribosomal subunit"
"400"	"YKR078W"	"Cytoplasmic protein of unknown function; potential Cdc28p substrate; contains a Phox homology (PX) domain and specifically binds phosphatidylinositol 3-phosphate (PtdIns-3-P); YKR078W has a paralog, VPS5, that arose from the whole genome duplication"
"401"	"YKR081C"	"Essential protein involved in rRNA maturation and ribosomal assembly; involved in the processing of pre-rRNA and the assembly of the 60S ribosomal subunit; interacts with ribosomal protein L11; localizes predominantly to the nucleolus; constituent of 66S pre-ribosomal particles"
"402"	"YLL008W"	"Nucleolar DEAD-box protein required for ribosome assembly and function; including synthesis of 60S ribosomal subunits; constituent of 66S pre-ribosomal particles"
"403"	"YLL011W"	"Protein required for biogenesis of 40S (small) ribosomal subunit; has similarity to the beta subunit of trimeric G-proteins and the splicing factor Prp4p; essential gene"
"404"	"YLL013C"	"Protein of the mitochondrial outer surface; links the Arp2/3 complex with the mitochore during anterograde mitochondrial movement; also binds to and promotes degradation of mRNAs for select nuclear-encoded mitochondrial proteins"
"405"	"YLL018C"	"Aspartyl-tRNA synthetase, primarily cytoplasmic; homodimeric enzyme that catalyzes the specific aspartylation of tRNA(Asp); class II aminoacyl tRNA synthetase; binding to its own mRNA may confer autoregulation; shares five highly conserved amino acids with human that when mutated cause leukoencephalopathy characterized by hypomyelination with brain stem and spinal cord involvement and leg spasticity (HBSL)"
"406"	"YLL021W"	"Component of the polarisome; functions in actin cytoskeletal organization during polarized growth; acts as a scaffold for Mkk1p and Mpk1p cell wall integrity signaling components; potential Cdc28p substrate; coding sequence contains length polymorphisms in different strains; SPA2 has a paralog, SPH1, that arose from the whole genome duplication"
"407"	"YLL024C"	"ATP-binding protein; involved in protein folding and vacuolar import of proteins; member of heat shock protein 70 (HSP70) family; associated with the chaperonin-containing T-complex; present in the cytoplasm, vacuolar membrane and cell wall; 98% identical with paralog Ssa1p, but subtle differences between the two proteins provide functional specificity with respect to propagation of yeast [URE3] prions and vacuolar-mediated degradations of gluconeogenesis enzymes"
"408"	"YLL026W"	"Disaggregase; heat shock protein that cooperates with Ydj1p (Hsp40) and Ssa1p (Hsp70) to refold and reactivate previously denatured, aggregated proteins; responsive to stresses including: heat, ethanol, and sodium arsenite; involved in [PSI+] propagation; protein becomes more abundant and forms cytoplasmic foci in response to DNA replication stress; potentiated Hsp104p variants decrease TDP-43 proteotoxicity by eliminating its cytoplasmic aggregation"
"409"	"YLL032C"	"Protein of unknown function; may interact with ribosomes, based on co-purification experiments; green fluorescent protein (GFP)-fusion protein localizes to the cytoplasm; YLL032C is not an essential gene"
"410"	"YLL034C"	"Putative ATPase of the AAA family; required for export of pre-ribosomal large subunits from the nucleus; distributed between the nucleolus, nucleoplasm, and nuclear periphery depending on growth conditions"
"411"	"YLL045C"	"Ribosomal 60S subunit protein L8B; required for processing of 27SA3 pre-rRNA to 27SB pre-rRNA during assembly of large ribosomal subunit; depletion leads to a turnover of pre-rRNA; L8 binds to Domain I of 25S and 5.8 S rRNAs; mutation results in decreased amounts of free 60S subunits; homologous to mammalian ribosomal protein L7A, no bacterial homolog; RPL8B has a paralog, RPL8A, that arose from the whole genome duplication"
"412"	"YLR022C"	"Guanine nucleotide exchange factor (GEF) for Ria1p; essential protein involved in ribosome maturation; with Ria1p, promotes release of Tif6p from 60S ribosomal subunits in the cytoplasm so that they can assemble with 40S subunits to generate mature ribosomes; ortholog of the human protein (SBDS) responsible for autosomal recessive Shwachman-Bodian-Diamond Syndrome; highly conserved across archaea and eukaryotes"
"413"	"YLR025W"	"One of four subunits of the ESCRT-III complex; involved in the sorting of transmembrane proteins into the multivesicular body (MVB) pathway; recruited from the cytoplasm to endosomal membranes; ESCRT-III stands for endosomal sorting complex required for transport III"
"414"	"YLR029C"	"Ribosomal 60S subunit protein L15A; binds to 5.8 S rRNA; homologous to mammalian ribosomal protein L15, no bacterial homolog; RPL15A has a paralog, RPL15B, that arose from the whole genome duplication"
"415"	"YLR043C"	"Cytoplasmic thioredoxin isoenzyme; part of thioredoxin system which protects cells against oxidative and reductive stress; forms LMA1 complex with Pbi2p; acts as a cofactor for Tsa1p; required for ER-Golgi transport and vacuole inheritance; with Trx2p, facilitates mitochondrial import of small Tims Tim9p, Tim10p, Tim13p by maintaining them in reduced form; abundance increases iunder DNA replication stress; TRX1 has a paralog, TRX2, that arose from the whole genome duplication"
"416"	"YLR044C"	"Major of three pyruvate decarboxylase isozymes; key enzyme in alcoholic fermentation; decarboxylates pyruvate to acetaldehyde; involved in amino acid catabolism; subject to glucose-, ethanol-, and autoregulation; activated by phosphorylation in response to glucose levels"
"417"	"YLR048W"	"Protein component of the small (40S) ribosomal subunit; RPS0B has a paralog, RPS0A, that arose from the whole genome duplication; required for maturation of 18S rRNA along with Rps0Ap; deletion of either RPS0 gene reduces growth rate, deletion of both genes is lethal; homologous to human ribosomal protein SA and bacterial S2"
"418"	"YLR059C"	"3'-5' RNA exonuclease; involved in 3'-end processing of U4 and U5 snRNAs, 5S and 5.8S rRNAs, and RNase P and RNase MRP RNA; localized to mitochondria and null suppresses escape of mtDNA to nucleus in yme1 yme2 mutants; RNase D exonuclease"
"419"	"YLR061W"	"Ribosomal 60S subunit protein L22A; required for the oxidative stress response in yeast; homologous to mammalian ribosomal protein L22, no bacterial homolog; RPL22A has a paralog, RPL22B, that arose from the whole genome duplication"
"420"	"YLR075W"	"Ribosomal 60S subunit protein L10; responsible for joining the 40S and 60S subunits; regulates translation initiation; similar to members of the QM gene family; homologous to mammalian ribosomal protein L10 and bacterial L16; protein abundance increases in response to DNA replication stress; mutations in the human ortholog are associated with development of T-cell acute lymphoblastic leukemia and similar changes in the yeast gene result in ribosome biogenesis defects"
"421"	"YLR096W"	"Serine/threonine protein kinase involved in regulation of exocytosis; localizes to the cytoplasmic face of the plasma membrane; KIN2 has a paralog, KIN1, that arose from the whole genome duplication"
"422"	"YLR109W"	"Thiol-specific peroxiredoxin; reduces hydroperoxides to protect against oxidative damage; function in vivo requires covalent conjugation to Urm1p"
"423"	"YLR116W"	"Component of commitment complex; which defines first step in splicing pathway; essential protein that interacts with Mud2p and Prp40p, forming a bridge between the intron ends; also involved in nuclear retention of pre-mRNA; relocalizes to the cytosol in response to hypoxia"
"424"	"YLR150W"	"Protein required for optimal translation under nutrient stress; perturbs association of Yef3p with ribosomes; involved in TOR signaling; binds G4 quadruplex and purine motif triplex nucleic acid; helps maintain telomere structure; protein abundance increases in response to DNA replication stress; serves as a ribosome preservation factor both during quiescence and recovery"
"425"	"YLR167W"	"Fusion protein cleaved to yield ribosomal protein S31 and ubiquitin; ubiquitin may facilitate assembly of the ribosomal protein into ribosomes; interacts genetically with translation factor eIF2B; homologous to mammalian ribosomal protein S27A, no bacterial homolog"
"426"	"YLR175W"	"Pseudouridine synthase catalytic subunit of box H/ACA snoRNPs; acts on both large and small rRNAs and on snRNA U2; mutations in human ortholog dyskerin cause the disorder dyskeratosis congenita; small nucleolar ribonucleoprotein particles are also known as snoRNPs"
"427"	"YLR186W"	"Methyltransferase for rRNA; catalyzes methylation of the pseudouridine residue 1191 of 18S rRNA; member of the SPOUT methyltransferase family; required for maturation of 18S rRNA and for 40S ribosomal subunit production independently of methyltransferase activity; forms homodimers; human ortholog is mutated in Bowen-Conradi syndrome, and the equivalent mutation in yeast affects Emg1p dimerization and localization but not its methyltransferase activity"
"428"	"YLR192C"	"eIF3j component of translation initiation factor 3 (eIF3); dual function protein involved in translation initiation as a substoichiometric component (eIF3j) of eIF3; required for processing of 20S pre-rRNA; required at post-transcriptional step for efficient retrotransposition; absence results in decreased Ty1 Gag:GFP protein levels; binds to eIF3 subunits Rpg1p and Prt1p and 18S rRNA"
"429"	"YLR196W"	"Protein with WD-40 repeats involved in rRNA processing; associates with trans-acting ribosome biogenesis factors; similar to beta-transducin superfamily"
"430"	"YLR197W"	"Essential evolutionarily-conserved nucleolar protein; component of the box C/D snoRNP complexes that direct 2'-O-methylation of pre-rRNA during its maturation; overexpression causes spindle orientation defects"
"431"	"YLR216C"	"Peptidyl-prolyl cis-trans isomerase (cyclophilin); catalyzes the cis-trans isomerization of peptide bonds N-terminal to proline residues; plays a role in determining prion variants; binds to Hsp82p and contributes to chaperone activity; protein abundance increases in response to DNA replication stress"
"432"	"YLR221C"	"Protein with a likely role in ribosomal maturation; required for accumulation of wild-type levels of large (60S) ribosomal subunits; binds to the helicase Dbp6p in pre-60S ribosomal particles in the nucleolus"
"433"	"YLR249W"	"Gamma subunit of translational elongation factor eEF1B; stimulates the binding of aminoacyl-tRNA (AA-tRNA) to ribosomes by releasing eEF1A (Tef1p/Tef2p) from the ribosomal complex; contains two ABC cassettes; binds and hydrolyzes ATP; YEF3 has a paralog, HEF3, that arose from the whole genome duplication"
"434"	"YLR259C"	"Tetradecameric mitochondrial chaperonin; required for ATP-dependent folding of precursor polypeptides and complex assembly; prevents aggregation and mediates protein refolding after heat shock; role in mtDNA transmission; phosphorylated"
"435"	"YLR260W"	"Minor sphingoid long-chain base kinase; possibly involved in synthesis of long-chain base phosphates, which function as signaling molecules; LCB5 has a paralog, LCB4, that arose from the whole genome duplication"
"436"	"YLR262C-A"	"Protein of unknown that associates with ribosomes; null mutant exhibits translation defects, altered polyribosome profiles, and resistance to the translation inhibitor anisomcyin; protein abundance increases in response to DNA replication stress"
"437"	"YLR264W"	"Protein component of the small (40S) ribosomal subunit; homologous to mammalian ribosomal protein S28, no bacterial homolog; RPS28B has a paralog, RPS28A, that arose from the whole genome duplication"
"438"	"YLR276C"	"DEAD-box protein required for 27S rRNA processing; exhibits DNA, RNA and DNA/RNA helicase activities; ATPase activity shows preference for DNA over RNA; DNA helicase activity abolished by mutation in RNA-binding domain"
"439"	"YLR287C-A"	"Protein component of the small (40S) ribosomal subunit; homologous to mammalian ribosomal protein S30, no bacterial homolog; RPS30A has a paralog, RPS30B, that arose from the whole genome duplication"
"440"	"YLR287C-A"	"Protein component of the small (40S) ribosomal subunit; homologous to mammalian ribosomal protein S30, no bacterial homolog; RPS30B has a paralog, RPS30A, that arose from the whole genome duplication; protein abundance increases in response to DNA replication stress"
"441"	"YLR298C"	"Component of the U1 snRNP complex required for pre-mRNA splicing; putative ortholog of human U1C protein, which is involved in formation of a complex between U1 snRNP and the pre-mRNA 5' splice site"
"442"	"YLR309C"	"Protein involved in vesicular transport; mediates transport between an endosomal compartment and the Golgi, contains a Golgi-localization (GRIP) domain that interacts with activated Arl1p-GTP to localize Imh1p to the Golgi"
"443"	"YLR314C"	"Component of the septin ring that is required for cytokinesis; septins are GTP-binding proteins that assemble with other septins into rod-like complexes that can associate with other rods to form filament polymers; septin rings at the mother-bud neck act as scaffolds for recruiting factors needed for cell division and as barriers to prevent diffusion of specific proteins between mother and daughter cells"
"444"	"YLR325C"	"Ribosomal 60S subunit protein L38; homologous to mammalian ribosomal protein L38, no bacterial homolog"
"445"	"YLR328W"	"Nicotinic acid mononucleotide adenylyltransferase; catalyzes the transfer of the adenylyl moiety of ATP to nicotinamide mononucleotide to form NAD; involved in pathways of NAD biosynthesis, including the de novo, NAD(+) salvage, and nicotinamide riboside salvage pathways; homolog of human NMNAT; NMA1 has a paralog, NMA2, that arose from the whole genome duplication"
"446"	"YLR330W"	"Component of the exomer complex; exomer also contains Csh6p, Bch1p, Bch2p, and Bud7p and is involved in export of selected proteins, such as chitin synthase Chs3p, from the Golgi to the plasma membrane; Chs5p is the only protein with a BRCT domain that is not localized to the nucleus"
"447"	"YLR333C"	"Protein component of the small (40S) ribosomal subunit; homologous to mammalian ribosomal protein S25, no bacterial homolog; RPS25B has a paralog, RPS25A, that arose from the whole genome duplication"
"448"	"YLR340W"	"Conserved ribosomal protein P0 of the ribosomal stalk; involved in interaction between translational elongation factors and the ribosome; phosphorylated on serine 302; homologous to mammalian ribosomal protein LP0 and bacterial L10"
"449"	"YLR342W"	"Catalytic subunit of 1,3-beta-D-glucan synthase; functionally redundant with alternate catalytic subunit Gsc2p; binds to regulatory subunit Rho1p; involved in cell wall synthesis and maintenance; localizes to sites of cell wall remodeling; FKS1 has a paralog, GSC2, that arose from the whole genome duplication"
"450"	"YLR371W"	"GDP/GTP exchange factor (GEF) for Rho1p and Rho2p; mutations are synthetically lethal with mutations in rom1, which also encodes a GEF; Rom2p localization to the bud surface is dependent on Ack1p; ROM2 has a paralog, ROM1, that arose from the whole genome duplication"
"451"	"YLR380W"	"Phosphatidylinositol transfer protein; has a potential role in regulating lipid and fatty acid metabolism under heme-depleted conditions; interacts specifically with thioredoxin peroxidase; may have a role in oxidative stress resistance; protein abundance increases in response to DNA replication stress"
"452"	"YLR384C"	"Subunit of Elongator complex; Elongator is required for modification of wobble nucleosides in tRNA; maintains structural integrity of Elongator; homolog of human IKAP, mutations in which cause familial dysautonomia (FD)"
"453"	"YLR388W"	"Protein component of the small (40S) ribosomal subunit; homologous to mammalian ribosomal protein S29 and bacterial S14; RPS29A has a paralog, RPS29B, that arose from the whole genome duplication"
"454"	"YLR398C"	"Ski complex component and putative RNA helicase; mediates 3'-5' RNA degradation by the cytoplasmic exosome; null mutants have superkiller phenotype of increased viral dsRNAs and are synthetic lethal with mutations in 5'-3' mRNA decay; mutations in the human ortholog, SKIV2L, causes Syndromic diarrhea/Trichohepatoenteric (SD/THE) syndrome"
"455"	"YLR401C"	"Dihydrouridine synthase; member of a widespread family of conserved proteins including Smm1p, Dus1p, and Dus4p; contains a consensus oleate response element (ORE) in its promoter region; forms nuclear foci upon DNA replication stress"
"456"	"YLR410W"	"Inositol hexakisphosphate and inositol heptakisphosphate kinase; inositol heptakisphosphate (IP7) production is important for phosphate signaling; involved in cortical actin cytoskeleton function, and invasive pseudohyphal growth analogous to S. pombe asp1; inositol hexakisphosphate is also known as IP6"
"457"	"YLR412W"	"Protein involved in microtubule-related processes; GFP-fusion protein localizes to the cytoplasm and is induced in response to the DNA-damaging agent MMS; YLR412W is not an essential gene; similar to Arabidopsis SRR1 gene"
"458"	"YLR419W"	"Putative helicase with limited sequence similarity to human Rb protein; the authentic, non-tagged protein is detected in highly purified mitochondria in high-throughput studies; YLR419W is not an essential gene"
"459"	"YLR427W"	"Cytoplasmic protein of unknown function; induced in response to mycotoxin patulin; ubiquitinated protein similar to the human ring finger motif protein RNF10; predicted to be involved in repair of alkylated DNA due to interaction with MAG1"
"460"	"YLR435W"	"Protein with a potential role in pre-rRNA processing"
"461"	"YLR438C-A"	"Lsm (Like Sm) protein; part of heteroheptameric complexes (Lsm2p-7p and either Lsm1p or 8p): cytoplasmic Lsm1p complex involved in mRNA decay; nuclear Lsm8p complex part of U6 snRNP and possibly involved in processing tRNA, snoRNA, and rRNA; protein increases in abundance and relocalizes from nucleus to cytoplasmic foci upon DNA replication stress"
"462"	"YLR441C"	"Ribosomal protein 10 (rp10) of the small (40S) subunit; homologous to mammalian ribosomal protein S3A, no bacterial homolog; RPS1A has a paralog, RPS1B, that arose from the whole genome duplication"
"463"	"YLR448W"	"Ribosomal 60S subunit protein L6B; binds 5.8S rRNA; homologous to mammalian ribosomal protein L6, no bacterial homolog; RPL6B has a paralog, RPL6A, that arose from the whole genome duplication"
"464"	"YLR452C"	"GTPase-activating protein for Gpa1p; regulates desensitization to alpha factor pheromone; also required to prevent receptor-independent signaling of the mating pathway; member of the RGS (regulator of G-protein signaling) family"
"465"	"YML007W"	"Basic leucine zipper (bZIP) transcription factor; required for oxidative stress tolerance; activated by H2O2 through the multistep formation of disulfide bonds and transit from the cytoplasm to the nucleus; Yap1p is degraded in the nucleus after the oxidative stress has passed; mediates resistance to cadmium; relative distribution to the nucleus increases upon DNA replication stress; YAP1 has a paralog, CAD1, that arose from the whole genome duplication"
"466"	"YML010W"	"Component of the universally conserved Spt4/5 complex (DSIF complex); the complex has multiple roles in concert with RNA polymerases I and II, including regulation of transcription elongation, RNA processing, quality control, and transcription-coupled DNA repair"
"467"	"YML017W"	"Asn rich cytoplasmic protein that contains RGG motifs; high-copy suppressor of group II intron-splicing defects of a mutation in MRS2 and of a conditional mutation in POL1 (DNA polymerase alpha); possible role in mitochondrial mRNA splicing"
"468"	"YML024W"	"Ribosomal protein 51 (rp51) of the small (40s) subunit; homologous to mammalian ribosomal protein S17, no bacterial homolog; RPS17A has a paralog, RPS17B, that arose from the whole genome duplication"
"469"	"YML028W"	"Thioredoxin peroxidase; acts as both a ribosome-associated and free cytoplasmic antioxidant; self-associates to form high-molecular weight chaperone complex under oxidative stress; deletion causes mutator phenotype; protein abundance increases and forms cytoplasmic foci during DNA replication stress; chaperone activity is essential for growth under zinc deficiency; required for telomere length maintenance; TSA1 has a paralog, TSA2, that arose from the whole genome duplication"
"470"	"YML036W"	"Component of the EKC/KEOPS complex; EKC/KEOPS complex is required for t6A tRNA modification and may have roles in telomere maintenance and transcription; Cgi121p is dispensable for tRNA modification; other complex members are Bud32p, Kae1p, Pcc1p, and Gon7p"
"471"	"YML063W"	"Ribosomal protein 10 (rp10) of the small (40S) subunit; homologous to mammalian ribosomal protein S3A, no bacterial homolog; RPS1B has a paralog, RPS1A, that arose from the whole genome duplication"
"472"	"YML073C"	"Ribosomal 60S subunit protein L6A; N-terminally acetylated; binds 5.8S rRNA; homologous to mammalian ribosomal protein L6, no bacterial homolog; RPL6A has a paralog, RPL6B, that arose from the whole genome duplication"
"473"	"YML074C"	"Nucleolar peptidyl-prolyl cis-trans isomerase (PPIase); FK506 binding protein; phosphorylated by casein kinase II (Cka1p-Cka2p-Ckb1p-Ckb2p) and dephosphorylated by Ptp1p; FPR3 has a paralog, FPR4, that arose from the whole genome duplication"
"474"	"YML080W"	"Dihydrouridine synthase; member of a widespread family of conserved proteins including Smm1p, Dus3p, and Dus4p; modifies pre-tRNA(Phe) at U17"
"475"	"YML082W"	"Putative protein predicted to have carbon-sulfur lyase activity; transcriptionally regulated by Upc2p via an upstream sterol response element; green fluorescent protein (GFP)-fusion protein localizes to the nucleus and the cytoplasm; not an essential gene; YML082W has a paralog, STR2, that arose from the whole genome duplication"
"476"	"YML093W"	"Subunit of U3-containing Small Subunit (SSU) processome complex; involved in production of 18S rRNA and assembly of small ribosomal subunit"
"477"	"YML100W"	"Large subunit of trehalose 6-phosphate synthase/phosphatase complex; Tps1p-Tps2p complex converts uridine-5'-diphosphoglucose and glucose 6-phosphate to trehalose; contributes to survival to acute lethal heat stress; mutant has aneuploidy tolerance; protein abundance increases in response to DNA replication stress; TSL1 has a paralog, TPS3, that arose from the whole genome duplication"
"478"	"YML103C"	"Subunit of the inner ring of the nuclear pore complex (NPC); contributes to NPC organization and nucleocytoplasmic transport; homologous to human NUP188"
"479"	"YML111W"	"Component of the Rsp5p E3-ubiquitin ligase complex; involved in intracellular amino acid permease sorting, functions in heat shock element mediated gene expression, essential for growth in stress conditions; BUL2 has a paralog, BUL1, that arose from the whole genome duplication"
"480"	"YML113W"	"DNA binding protein that recognizes oligo(dA).oligo(dT) tracts; Arg side chain in its N-terminal pentad Gly-Arg-Lys-Pro-Gly repeat is required for DNA-binding; relocalizes to the cytosol in response to hypoxia; not essential for viability"
