"ENSEMBL"	"DESCRIPTION"
"1"	"RPL17AA"	NA
"2"	"RPL18A2"	NA
"3"	"RPS24EA"	NA
"4"	"TIF4631"	NA
"5"	"TIF4632"	NA
"6"	"YAL003W"	"Translation elongation factor 1 beta; stimulates nucleotide exchange to regenerate EF-1 alpha-GTP for the next elongation cycle; part of the EF-1 complex, which facilitates binding of aminoacyl-tRNA to the ribosomal A site"
"7"	"YAL005C"	"ATPase involved in protein folding and NLS-directed nuclear transport; member of HSP70 family; forms chaperone complex with Ydj1p; localized to nucleus, cytoplasm, and cell wall; 98% identical with paralog Ssa2p, but subtle differences between the two proteins provide functional specificity with respect to propagation of yeast [URE3] prions and vacuolar-mediated degradations of gluconeogenesis enzymes; general targeting factor of Hsp104p to prion fibrils"
"8"	"YAL021C"	"Component of the CCR4-NOT transcriptional complex; CCR4-NOT is involved in regulation of gene expression; component of the major cytoplasmic deadenylase, which is involved in mRNA poly(A) tail shortening"
"9"	"YAL035W"	"Translation initiation factor eIF5B; GTPase that promotes Met-tRNAiMet binding to ribosomes and ribosomal subunit joining; promotes GTP-dependent maturation of 18S rRNA by Nob1p; protein abundance increases in response to DNA replication stress; homolog of bacterial IF2"
"10"	"YAL038W"	"Pyruvate kinase; functions as a homotetramer in glycolysis to convert phosphoenolpyruvate to pyruvate, the input for aerobic (TCA cycle) or anaerobic (glucose fermentation) respiration; regulated via allosteric activation by fructose bisphosphate; CDC19 has a paralog, PYK2, that arose from the whole genome duplication"
"11"	"YAR007C"	"Subunit of heterotrimeric Replication Protein A (RPA); which is a highly conserved single-stranded DNA binding protein involved in DNA replication, repair, and recombination; role in DNA catenation/decatenation pathway of chromosome disentangling; relocalizes to the cytosol in response to hypoxia"
"12"	"YBL004W"	"Component of the small-subunit (SSU) processome; SSU processome is involved in the biogenesis of the 18S rRNA"
"13"	"YBL016W"	"Mitogen-activated serine/threonine protein kinase involved in mating; phosphoactivated by Ste7p; substrates include Ste12p, Far1p, Bni1p, Sst2p; inhibits invasive growth during mating by phosphorylating Tec1p, promoting its; inhibits recruitment of Ste5p, Cdc42p-mediated asymmetry and mating morphogenesis"
"14"	"YBL024W"	"S-adenosyl-L-methionine-dependent tRNA: m5C-methyltransferase; methylates cytosine to m5C at several positions in tRNAs and intron-containing pre-tRNAs; increases proportion of tRNALeu(CAA) with m5C at wobble position in response to hydrogen peroxide, causing selective translation of mRNA from genes enriched in TTG codon; loss of NCL1 confers hypersensitivity to oxidative stress; similar to Nop2p and human proliferation associated nucleolar protein p120"
"15"	"YBL026W"	"Lsm (Like Sm) protein; part of heteroheptameric complexes (Lsm2p-7p and either Lsm1p or 8p): cytoplasmic Lsm1p complex involved in mRNA decay; nuclear Lsm8p complex part of U6 snRNP and possibly involved in processing tRNA, snoRNA, and rRNA; relocalizes from nucleus to cytoplasmic foci upon DNA replication stress"
"16"	"YBL030C"	"Major ADP/ATP carrier of the mitochondrial inner membrane; exchanges cytosolic ADP for mitochondrially synthesized ATP; also imports heme and ATP; phosphorylated; required for viability in many lab strains that carry a sal1 mutation; PET9 has a paralog, AAC3, that arose from the whole genome duplication"
"17"	"YBL032W"	"RNA binding protein involved in asymmetric localization of ASH1 mRNA; represses translation of ASH1 mRNA, an effect reversed by Yck1p-dependent phosphoryation; regulates telomere position effect and length; similarity to hnRNP-K"
"18"	"YBL041W"	"Beta 6 subunit of the 20S proteasome"
"19"	"YBL051C"	"Protein involved in G2/M phase progression and response to DNA damage; interacts with Rad53p; contains an RNA recognition motif, a nuclear localization signal, and several SQ/TQ cluster domains; hyperphosphorylated in response to DNA damage"
"20"	"YBL072C"	"Protein component of the small (40S) ribosomal subunit; homologous to mammalian ribosomal protein S8, no bacterial homolog; RPS8A has a paralog, RPS8B, that arose from the whole genome duplication"
"21"	"YBL072C"	"Protein component of the small (40S) ribosomal subunit; homologous to mammalian ribosomal protein S8, no bacterial homolog; RPS8B has a paralog, RPS8A, that arose from the whole genome duplication"
"22"	"YBL076C"	"Cytoplasmic isoleucine-tRNA synthetase; target of the G1-specific inhibitor reveromycin A"
"23"	"YBL081W"	"Non-essential protein of unknown function; null mutation results in a decrease in plasma membrane electron transport"
"24"	"YBL085W"	"Protein implicated in polar growth; functionally redundant with Boi2p; interacts with bud-emergence protein Bem1p; contains an SH3 (src homology 3) domain and a PH (pleckstrin homology) domain; relocalizes from bud neck to cytoplasm upon DNA replication stress; BOI1 has a paralog, BOI2, that arose from the whole genome duplication"
"25"	"YBL091C"	"Methionine aminopeptidase; catalyzes the cotranslational removal of N-terminal methionine from nascent polypeptides; function is partially redundant with that of Map1p"
"26"	"YBL092W"	"Ribosomal 60S subunit protein L32; overexpression disrupts telomeric silencing; homologous to mammalian ribosomal protein L32, no bacterial homolog"
"27"	"YBL101C"	"Protein involved in regulating endocytosis of plasma membrane proteins; identified as a substrate for ubiquitination by Rsp5p and deubiquitination by Ubp2p; promoter contains several Gcn4p binding elements; ECM21 has a paralog, CSR2, that arose from the whole genome duplication"
"28"	"YBR009C"	"Histone H4; core histone protein required for chromatin assembly and chromosome function; one of two identical histone proteins (see also HHF1); contributes to telomeric silencing; N-terminal domain involved in maintaining genomic integrity"
"29"	"YBR009C"	"Histone H4; core histone protein required for chromatin assembly and chromosome function; one of two identical histone proteins (see also HHF2); contributes to telomeric silencing; N-terminal domain involved in maintaining genomic integrity"
"30"	"YBR017C"	"Transportin or cytosolic karyopherin beta 2; functions in the rg-nuclear localization signal-mediated nuclear import/reimport of mRNA-binding proteins Nab2p and Hrp1p; regulates asymmetric protein synthesis in daughter cells during mitosis"
"31"	"YBR025C"	"P-loop ATPase with similarity to human OLA1 and bacterial YchF; identified as specifically interacting with the proteasome; protein abundance increases in response to hydrogen peroxide and to DNA replication stress"
"32"	"YBR059C"	"Ser-Thr protein kinase; member (with Ark1p and Prk1p) of the Ark kinase family; involved in endocytosis and actin cytoskeleton organization"
"33"	"YBR065C"	"Pre-mRNA splicing factor; facilitates the cooperative formation of U2/U6 helix II in association with stem II in the spliceosome, function may be regulated by Slu7p"
"34"	"YBR079C"	"eIF3a subunit of the eukaryotic translation initiation factor 3 (eIF3); subunit of the core complex of eIF3; essential for translation; part of a Prt1p-Rpg1p-Nip1p subcomplex that stimulates binding of mRNA and tRNA(i)Met to ribosomes; involved in translation reinitiation"
"35"	"YBR084C-A"	"Ribosomal 60S subunit protein L19B; rpl19a and rpl19b single null mutations result in slow growth, while the double null mutation is lethal; homologous to mammalian ribosomal protein L19, no bacterial homolog; RPL19B has a paralog, RPL19A, that arose from the whole genome duplication"
"36"	"YBR084C-A"	"Ribosomal 60S subunit protein L19A; rpl19a and rpl19b single null mutations result in slow growth, while the double null mutation is lethal; homologous to mammalian ribosomal protein L19, no bacterial homolog; RPL19A has a paralog, RPL19B, that arose from the whole genome duplication"
"37"	"YBR089C-A"	"High-mobility group (HMG) protein, binds to and remodels nucleosomes; involved in recruiting FACT and other chromatin remodelling complexes to the chromosomes; functionally redundant with Nhp6Ap; homologous to mammalian HMGB1 and HMGB2; NHP6B has a paralog, NHP6A, that arose from the whole genome duplication"
"38"	"YBR108W"	"Protein that inhibits barbed-end actin filament elongation; interacts with Rvs167p; null mutant is viable and displays elevated frequency of mitochondrial genome loss"
"39"	"YBR130C"	"Protein adaptor between Myo4p and the She2p-mRNA complex; part of the mRNA localization machinery that restricts accumulation of certain proteins to the bud; also required for cortical ER inheritance"
"40"	"YBR135W"	"Cyclin-dependent protein kinase regulatory subunit and adaptor; interacts with Cdc28p(Cdk1p); required for G1/S and G2/M phase transitions and budding; mediates the phosphorylation and degradation of Sic1p; modulates proteolysis of M-phase targets through interactions with the proteasome; role in transcriptional regulation, recruiting proteasomal subunits to target gene promoters"
"41"	"YBR143C"	"Polypeptide release factor (eRF1) in translation termination; mutant form acts as a recessive omnipotent suppressor; methylated by Mtq2p-Trm112p in ternary complex eRF1-eRF3-GTP; mutation of methylation site confers resistance to zymocin; has a role in cytokinesis through interaction with Mlc1p"
"42"	"YBR172C"	"GYF domain protein; involved in COPII vesicle formation; interacts with the Sec23p/Sec24p subcomplex; overexpression suppresses the temperature sensitivity of a myo2 mutant; similar to S. pombe Mpd2; SMY2 has a paralog, SYH1, that arose from the whole genome duplication"
"43"	"YBR189W"	"Protein component of the small (40S) ribosomal subunit; homologous to mammalian ribosomal protein S9 and bacterial S4; RPS9B has a paralog, RPS9A, that arose from the whole genome duplication"
"44"	"YBR191W"	"Ribosomal 60S subunit protein L21A; homologous to mammalian ribosomal protein L21, no bacterial homolog; RPL21A has a paralog, RPL21B, that arose from the whole genome duplication"
"45"	"YBR196C"	"Glycolytic enzyme phosphoglucose isomerase; catalyzes the interconversion of glucose-6-phosphate and fructose-6-phosphate; required for cell cycle progression and completion of the gluconeogenic events of sporulation"
"46"	"YBR212W"	"RNA binding protein that negatively regulates growth rate; interacts with the 3' UTR of the mitochondrial porin (POR1) mRNA and enhances its degradation; overexpression impairs mitochondrial function; interacts with Dhh1p to mediate POR1 mRNA decay; expressed in stationary phase"
"47"	"YBR233W"	"RNA binding protein; has similarity to mammalian heterogeneous nuclear RNP K protein, involved in the regulation of telomere position effect and telomere length; relative distribution to the nucleus increases upon DNA replication stress"
"48"	"YBR234C"	"Subunit of the ARP2/3 complex; ARP2/3 is required for the motility and integrity of cortical actin patches"
"49"	"YBR238C"	"Mitochondrial membrane protein; not required for respiratory growth but causes a synthetic respiratory defect in combination with rmd9 mutations; transcriptionally up-regulated by TOR; deletion increases life span; YBR238C has a paralog, RMD9, that arose from the whole genome duplication"
"50"	"YBR247C"	"Protein associated with U3 and U14 snoRNAs; required for pre-rRNA processing and 40S ribosomal subunit synthesis; localized in the nucleus and concentrated in the nucleolus"
"51"	"YBR255W"	"Protein of unknown function; required for normal growth rate at 15 degrees C; green fluorescent protein (GFP)-fusion protein localizes to the cytoplasm in a punctate pattern; mtc4 is synthetically sick with cdc13-1"
"52"	"YCL011C"	"Poly(A+) RNA-binding protein; involved in the export of mRNAs from the nucleus to the cytoplasm; similar to Npl3p; also binds single-stranded telomeric repeat sequence in vitro; relocalizes to the cytosol in response to hypoxia; GBP2 has a paralog, HRB1, that arose from the whole genome duplication"
"53"	"YCL035C"	"Glutathione-dependent disulfide oxidoreductase; hydroperoxide and superoxide-radical responsive, heat-stable, with active site cysteine pair; protects cells from oxidative damage; GRX1 has a paralog, GRX2, that arose from the whole genome duplication; protein abundance increases in response to DNA replication stress"
"54"	"YCL036W"	"Protein of unknown function; identified as a high-copy suppressor of a dbp5 mutation; GFD2 has a paralog, YDR514C, that arose from the whole genome duplication"
"55"	"YCL037C"	"Cytoplasmic RNA-binding protein; shuttles between nucleus and cytoplasm and is exported from the nucleus in an mRNA export-dependent manner; associates with translating ribosomes; involved in heme regulation of Hap1p as a component of the HMC complex, also involved in the organization of actin filaments; contains a La motif; SRO9 has a paralog, SLF1, that arose from the whole genome duplication"
"56"	"YCL040W"	"Glucokinase; catalyzes the phosphorylation of glucose at C6 in the first irreversible step of glucose metabolism; one of three glucose phosphorylating enzymes; expression regulated by non-fermentable carbon sources; GLK1 has a paralog, EMI2, that arose from the whole genome duplication"
"57"	"YCL050C"	"AP4A phosphorylase; bifunctional diadenosine 5',5'''-P1,P4-tetraphosphate phosphorylase and ADP sulfurylase involved in catabolism of bis(5'-nucleosidyl) tetraphosphates; catalyzes phosphorolysis of dinucleoside oligophosphates, cleaving substrates' alpha/beta-anhydride bond and introducing Pi into the beta-position of the corresponding NDP formed; protein abundance increases under DNA replication stress; APA1 has a paralog, APA2, that arose from the whole genome duplication"
"58"	"YCR008W"	"Ser/Thr protein kinase involved in salt tolerance; funtions in regulation of Trk1p-Trk2p potassium transporter; partially redundant with Hal5p; has similarity to Npr1p"
"59"	"YCR009C"	"Amphiphysin-like lipid raft protein; interacts with Rvs167p and regulates polarization of the actin cytoskeleton, endocytosis, cell polarity, cell fusion and viability following starvation or osmotic stress"
"60"	"YCR012W"	"3-phosphoglycerate kinase; catalyzes transfer of high-energy phosphoryl groups from the acyl phosphate of 1,3-bisphosphoglycerate to ADP to produce ATP; key enzyme in glycolysis and gluconeogenesis"
"61"	"YCR028C-A"	"ssDNA-binding protein essential for mitochondrial genome maintenance; involved in mitochondrial DNA replication"
"62"	"YCR030C"	"Negative regulator of WASP-Arp23 complex; involved in endocytic site formation; directly inhibits Las17p stimulation of Arp23 complex-mediated actin assembly in vitro; may regulate assembly and disassembly of the septin ring; colocalizes and interacts with septin subunits; potential role in actin cytoskeletal organization"
"63"	"YCR077C"	"Deadenylation-dependent mRNA-decapping factor; also required for faithful chromosome transmission, maintenance of rDNA locus stability, and protection of mRNA 3'-UTRs from trimming; associated with topoisomerase II; functionally linked to Pab1p; forms cytoplasmic foci upon DNA replication stress"
"64"	"YCR088W"	"Actin-binding protein of the cortical actin cytoskeleton; important for activation of the Arp2/3 complex that plays a key role actin in cytoskeleton organization; inhibits barbed-end actin filament elongation; phosphorylation within its PRR (Proline-Rich Region), mediated by Cdc28p and Pho85p, protects Abp1p from proteolysis mediated by its own PEST sequences"
"65"	"YCR090C"	"Putative protein of unknown function; green fluorescent protein (GFP)-fusion protein localizes to the cytoplasm and nucleus; YCR090C is not an essential gene"
"66"	"YDL014W"	"Histone glutamine methyltransferase, modifies H2A at Q105 in nucleolus; component of the small subunit processome complex, which is required for processing of pre-18S rRNA; ortholog of mammalian fibrillarin"
"67"	"YDL030W"	"Subunit of the SF3a splicing factor complex; required for spliceosome assembly; acts after the formation of the U1 snRNP-pre-mRNA complex"
"68"	"YDL031W"	"Putative ATP-dependent RNA helicase of the DEAD-box protein family; constituent of 66S pre-ribosomal particles; essential protein involved in ribosome biogenesis"
"69"	"YDL040C"	"Subunit of protein N-terminal acetyltransferase NatA; NatA is comprised of Nat1p, Ard1p, and Nat5p; N-terminally acetylates many proteins, which influences multiple processes such as the cell cycle, heat-shock resistance, mating, sporulation, and telomeric silencing"
"70"	"YDL051W"	"RNA binding protein required for maturation of tRNA and U6 snRNA; acts as a molecular chaperone for RNAs transcribed by polymerase III; homologous to human La (SS-B) autoantigen"
"71"	"YDL053C"	"Pbp1p binding protein; interacts strongly with Pab1p-binding protein 1 (Pbp1p) in the yeast two-hybrid system; also interacts with Lsm12p in a copurification assay; relative distribution to the nucleus increases upon DNA replication stress"
"72"	"YDL055C"	"GDP-mannose pyrophosphorylase (mannose-1-phosphate guanyltransferase); synthesizes GDP-mannose from GTP and mannose-1-phosphate in cell wall biosynthesis; required for normal cell wall structure"
"73"	"YDL060W"	"Protein required for processing of 20S pre-rRNA in the cytoplasm; associates with pre-40S ribosomal particles; inhibits the premature association of 60S subunits with assembling 40S subunits in the cytoplasm; similar to Bms1p; relocalizes from nucleus to cytoplasm upon DNA replication stress"
"74"	"YDL075W"	"Ribosomal 60S subunit protein L31A; associates with karyopherin Sxm1p; loss of both Rpl31p and Rpl39p confers lethality; homologous to mammalian ribosomal protein L31, no bacterial homolog; RPL31A has a paralog, RPL31B, that arose from the whole genome duplication"
"75"	"YDL084W"	"Component of the TREX complex required for nuclear mRNA export; member of the DEAD-box RNA helicase superfamily and is involved in early and late steps of spliceosome assembly; homolog of the human splicing factor hUAP56; relocalizes from nucleus to cytoplasm upon DNA replication stress"
"76"	"YDL085C-A"	"Putative protein of unknown function; green fluorescent protein (GFP)-fusion protein localizes to the cytoplasm and nucleus"
"77"	"YDL124W"	"NADPH-dependent alpha-keto amide reductase; reduces aromatic alpha-keto amides, aliphatic alpha-keto esters, and aromatic alpha-keto esters; member of the aldo-keto reductase (AKR) family; protein abundance increases in response to DNA replication stress"
"78"	"YDL126C"	"AAA ATPase; subunit of polyubiquitin-selective segregase complex involved in ERAD, cell wall integrity during heat stress, mitotic spindle disassembly; subunit of complex involved in mitochondria-associated degradation; role in mobilizing membrane bound transcription factors by regulated ubiquitin/proteasome-dependent processing, in macroautophagy, PMN, RAD, ribophagy, homotypic ER membrane fusion, disassembly of Met30p from SCF complex, functional ortholog of human p97/VCP"
"79"	"YDL132W"	"Cullin; structural protein of SCF complexes (which also contain Skp1p, Cdc34p, Hrt1p and an F-box protein) involved in ubiquitination; SCF promotes the G1-S transition by targeting G1 cyclins and the Cln-CDK inhibitor Sic1p for degradation"
"80"	"YDL140C"	"RNA polymerase II largest subunit B220; part of central core; phosphorylation of C-terminal heptapeptide repeat domain regulates association with transcription and splicing factors; similar to bacterial beta-prime"
"81"	"YDL143W"	"Subunit of the cytosolic chaperonin Cct ring complex; related to Tcp1p, required for the assembly of actin and tubulins in vivo"
"82"	"YDL145C"	"Alpha subunit of COPI vesicle coatomer complex; complex surrounds transport vesicles in the early secretory pathway"
"83"	"YDL148C"	"Nucleolar protein; forms a complex with Noc4p that mediates maturation and nuclear export of 40S ribosomal subunits; also present in the small subunit processome complex, which is required for processing of pre-18S rRNA"
"84"	"YDL160C"	"Cytoplasmic DExD/H-box helicase, stimulates mRNA decapping; coordinates distinct steps in mRNA function and decay, interacts with both the decapping and deadenylase complexes, may have a role in mRNA export and translation; C-terminus of Dhh1p interacts with Ngr1p and promotes POR1, but not EDC1 mRNA decay; forms cytoplasmic foci upon DNA replication stress"
"85"	"YDL167C"	"Putative RNA binding protein of unknown function; localizes to stress granules induced by glucose deprivation; predicted to be involved in ribosome biogenesis"
"86"	"YDL173W"	"Putative protein of unknown function; hyperphosphorylated upon rapamycin treatment in a Tap42p-dependent manner; green fluorescent protein (GFP)-fusion protein localizes to the cytoplasm; PAR32 is not an essential gene"
"87"	"YDL175C"	"RNA-binding subunit of the TRAMP nuclear RNA surveillance complex; involved in nuclear RNA processing and degradation; involved in TRAMP complex assembly as a bridge between Mtr4p and Trf4p; stimulates the poly(A) polymerase activity of Pap2p in vitro; has 5 zinc knuckle motifs; AIR2 has a paralog, AIR1, that arose from the whole genome duplication; Air2p and Air1p have nonredundant roles in regulation of substrate specificity of the exosome"
"88"	"YDL185W"	"Subunit A of the V1 peripheral membrane domain of V-ATPase; protein precursor undergoes self-catalyzed splicing to yield the extein Tfp1p and the intein Vde (PI-SceI), which is a site-specific endonuclease; the V1 peripheral membrane domain of the vacuolar H+-ATPase (V-ATPase) has eight subunits"
"89"	"YDL189W"	"Protein of unknown function; identified as a high copy suppressor of psk1 psk2 mutations that confer temperature-sensitivity for galactose utilization; proposed to bind single-stranded nucleic acids via its R3H domain"
"90"	"YDL192W"	"ADP-ribosylation factor; GTPase of the Ras superfamily involved in regulation of coated vesicle formation in intracellular trafficking within the Golgi; ARF1 has a paralog, ARF2, that arose from the whole genome duplication"
"91"	"YDL213C"	"rRNA-binding protein required for 40S ribosomal subunit biogenesis; contains an RNA recognition motif (RRM); hydrophilin essential to overcome the stress of the desiccation-rehydration process; NOP6 may be a fungal-specific gene as no homologs have been yet identified in higher eukaryotes"
"92"	"YDL219W"	"D-Tyr-tRNA(Tyr) deacylase; functions in protein translation, may affect nonsense suppression via alteration of the protein synthesis machinery; ubiquitous among eukaryotes"
"93"	"YDL223C"	"Shmoo tip protein, substrate of Hub1p ubiquitin-like protein; mutants are defective for mating projection formation, thereby implicating Hbt1p in polarized cell morphogenesis; HBT1 has a paralog, YNL195C, that arose from the whole genome duplication"
"94"	"YDL224C"	"Putative RNA binding protein; regulates the cell size requirement for passage through Start and commitment to cell division; WHI4 has a paralog, WHI3, that arose from the whole genome duplication"
"95"	"YDL229W"	"Cytoplasmic ATPase that is a ribosome-associated molecular chaperone; functions with J-protein partner Zuo1p; may be involved in folding of newly-made polypeptide chains; member of the HSP70 family; interacts with phosphatase subunit Reg1p; SSB1 has a paralog, SSB2, that arose from the whole genome duplication"
"96"	"YDR002W"	"Ran GTPase binding protein; involved in nuclear protein import and RNA export, ubiquitin-mediated protein degradation during the cell cycle; shuttles between the nucleus and cytoplasm; is essential; homolog of human RanBP1"
"97"	"YDR012W"	"Ribosomal 60S subunit protein L4B; homologous to mammalian ribosomal protein L4 and bacterial L4; RPL4B has a paralog, RPL4A, that arose from the whole genome duplication"
"98"	"YDR021W"	"Nucleolar protein required for maturation of 18S rRNA; member of the eIF4A subfamily of DEAD-box ATP-dependent RNA helicases"
"99"	"YDR023W"	"Cytosolic seryl-tRNA synthetase; class II aminoacyl-tRNA synthetase that aminoacylates tRNA(Ser), displays tRNA-dependent amino acid recognition which enhances discrimination of the serine substrate, interacts with peroxin Pex21p"
"100"	"YDR025W"	"Protein component of the small (40S) ribosomal subunit; homologous to mammalian ribosomal protein S11 and bacterial S17; RPS11B has a paralog, RPS11A, that arose from the whole genome duplication"
"101"	"YDR025W"	"Protein component of the small (40S) ribosomal subunit; homologous to mammalian ribosomal protein S11 and bacterial S17; RPS11A has a paralog, RPS11B, that arose from the whole genome duplication"
"102"	"YDR037W"	"Lysyl-tRNA synthetase"
"103"	"YDR049W"	"Component of a Cdc48p-complex involved in protein quality control; exhibits cytosolic and ER-membrane localization, with Cdc48p, during normal growth, and contributes to ER-associated degradation (ERAD) of specific substrates at a step after their ubiquitination; forms a mitochondrially-associated complex with Cdc48p and Npl4p under oxidative stress that is required for ubiquitin-mediated mitochondria-associated protein degradation (MAD); conserved in C. elegans and humans"
"104"	"YDR050C"	"Triose phosphate isomerase, abundant glycolytic enzyme; mRNA half-life is regulated by iron availability; transcription is controlled by activators Reb1p, Gcr1p, and Rap1p through binding sites in the 5' non-coding region; inhibition of Tpi1p activity by PEP (phosphoenolpyruvate) stimulates redox metabolism in respiring cells; E104D mutation in human TPI causes a rare autosomal disease"
"105"	"YDR051C"	"Acid phosphatase; involved in the non-vesicular transport of sterols in both directions between the endoplasmic reticulum and plasma membrane; deletion confers sensitivity to nickel"
